Date,Time,Ratings,Review_Title,Review_comment
7/10/2022,3:03:00 PM,1,Bathroom intense cleaning.,Had signed up to get there bathrooms cleaned. Was impressed with the fact that they had said they would start at nine in the morning the professional called to say he would be fifteen minutes late. He came half an hour late. That was still okay. At every point he would say he couldn't do this couldn't do that as the house was old. So none of the stains in the bathroom were addressed giving this excuse. On top of that he was on a personal call for one hour of the one and a half hours he spent in the house so obviously his mind was not concentrating on the work at hand. After doing two bathrooms when I pointed out that the condition of the bathroom was the same as it was before cleaning he got annoyed and asked me to cancel the service and asked me to clean it myself. That was really the last straw. Absolutely no courtesy and very unprofessional attitude. Will never recommend. Don't know how they have branches in Singapore and Dubai if this is the sort of service they provide.
7/9/2022,4:52:00 PM,1,Hoax and Fake Company,"Urban company employee damaged my appliance AC beyond repair.
Customer support is also not helpful.
Do not get any service from the company as they will take your appliance, damage it more and sometimes not return back the appliance and vanish."
7/7/2022,5:44:00 PM,1,Deep bathroom cleaning,"I updated a review earlier this month about URBAN COMPANY's bad customer service, as how the professional damaged the tiles, and doors with acid & broke the tap(Jaguar).
After million complaints & repeated customer service calls, I managed to get a professional for inspection where he clearly mentioned that it will require 2 services and change or parts.
So UC asked me to book services again on COD for cleaning as well as plumbing and sent a professional for cleaning who had no knowledge that I won't pay him UC will. The professional did his job & later texted me that UC denied the payment to him. The plumber also came but denied fixing the tap as it required a change of parts and mentioned very clearly that "" UC DOESNT PAY US BACK "" so he cant provide the booked service. PLUS professional did not even wear a UNIFORM.
I spoke to multiple customer support staff since 5 July but they all are USELESS
NEVER EVER USE THIS COMPANY"
6/28/2022,12:50:00 PM,1,Poorly managed company,"I don't think they will care about this review. Their only goal is to earn money.
Booked a cleaning service and took the day off for it- cleaner did not arrive- nor any calls from urban company to inform about the poor transaction management. Not worth putting your money in here. There are many other cleaning companies."
6/28/2022,1:13:00 PM,1,Classic home cleaning - very poor job done,Yesterday we got the classic home cleaning package executed.  Very poor workmanship and poor communication.  Too crowded with 6 workers working simultaneously giving very less option to monitor
6/28/2022,2:19:00 PM,1,Very very poor service done by refrigerator techni,"Never ever approach this company for any service.
I booked for less cooling for refrigerator and it has been 4 times we called out for the same problem because the technician did some collapse on the refrigerator. It stopped working completely and all the items inside fridge is rotten. We had daily needs for baby and we were completely disappointed with the service provided by technician named Santhosh. I booked for revisit twice and next time some other guy came and he was also harsh in responding. He has asked us to wait for two more days until wednesday. Who will take care of all expenses of rotten things for next two days?? Will urban company bear it? We already spent 15000 rs. Customer care also unethical and doesn't assign technician. They say they have only few SMEs and don't get their slots. Technicians speak in rude way that the job cannot be done within timeline.
This company is a looting agency. Better don't approach this"
6/25/2022,12:06:00 PM,1,Worst company to work with.,"This is the worst, unprofessional and untrustworthy company.I had booked yesterday's 9 am slot for kitchen deep cleaning and Deepak Kumar sahu was assigned for the service but after number of calls he finally arrived at 11am and it was very clear by his facial expressions that he was not in any mood to work.After wasting more 30 min he straight aways denied to work giving stupid reason.Their policy is if clients cancel or reschedule the service they charge penalty so even I askd the company to pay me penalty for not giving services but they straight away denied even that..They are not at all worth to place order for any services."
6/22/2022,3:06:00 PM,1,Don't fall into the trap!!!,"I decided to try them out despite being warned . They simply send people who come .claim they did some custom work .
Mention a completely different estimate from what is is mention on their site . And then there is no customer support or protection of any type.
Overhead water tank installation is supposed to cost 1100 for a 1500 ltr tank . The plumber who turned up said . it costs 6000 and charged 250 and went away . Gave me his private number to contact for installation."
6/16/2022,10:08:00 AM,1,Installation technician issues URBANCOMPANY.com,"Beware of cheating and fraudulent service by Urban Company.
I ordered for a ""bed installation service""( as mentioned in their website) from their website and also paid the required amount.
The technician(Sunil) was appointed arrived and after looking at the bed said the charges would be more as it was a new bed. He was charging a Bomb. Then he made me cancel the order at urban company after I agreed to pay him extra as I didn't want to loose more time for this . Urban company deducted Rs 50 from the amount I had paid.
This is sheer cheating please be aware."
6/1/2022,11:27:00 AM,1,Urban Company,"Unprofessional Urban Company they have No Contact Number for Raising Complaints. Most of their Electricians, Carpenters, Plumbers and AC Techinician’s are unprofessionals and They have No Knowledge. I have send them many messages through Feedback. Their is No Response from Urban Company Custmercare Team Until Today. Even Logout and Login with New 1 Year Subscription. Their System is not working properly. I have tried to Book a Plumber. But their is No Response from Urban Company. If you login to their Website. You will see that their Offices are Located Across INDIA, UAE, USA, Singapore and Australia. But there are No Contact Numbers Shown on their Urban Company Website."
5/30/2022,6:57:00 PM,1,DO NOT CALL URBAN COMPANY,"Lets understand the model of aggregators such as Urban company. to meet their financial targets, these aggregators such as UC empanel some street boys/ vendors after their some very basic checks and verifications etc. When customer complains, UC rely heavily on inputs from professionals and never bother to visit the site for first hand verification of the matter and issue. this leaves customer at the mercy of the telecalls.  Competency of these boys is a big question. The big safety concern is that the so called'professional' brings with him some other street guy to'assist' him. And this second guy is not verified and not trained and not a professional. This second guy is just another labourer / maid type, who does all heavy physical work such as scrubbing etc to make things  cleaned visually and in process damaging the items.  Second big concern is the unverified / uncertified chemicals(mostly acids) they use on our costly  equipments/ fittings and fixtures. I had very bad experience  with UC.'Professional' and his'assistant' damaged chrome electroplating and put big scratches on my costly bathroom fittings using very hard scrubbers and chemicals. my suggestion to all customers is to take good quality HD pics of all fittings and fixtures and keep as record. you will need these pics at the time of claim. in my case UC claimed that my fittings were like that only. When I asked urban company to share pictures taken at the end of the job by the'professional', they did not. And on regular follow up of  the case, UC used their last tool i.e. the refund. Now see what customers have to settle with, is damaged equipments and fittings fixtures.  The'professional' left work without completing full job when damage was shown to him. the'professional' was leaving behind the'assistant' to complete the job so that he could attend another UC job somewhere else. In my opinion it is better to call local helper and use some good quality cleaners which are easily available in market and online(Amazon etc). you will find so many videos on youtube for DYI cleaning hacks.  you will be saving lot of money by avoiding expenditure on restoring and replacing your costly items. DO NOT spoil your things by calling UC professional. I did and now wasting time writing reviews."
5/24/2022,7:44:00 PM,1,Worst service,To be honest I think everyone time is precious and needs to be respected .  I placed my booking in the mid day may be before that and selected appoint of 7pm . First call I received from your executive and they said  no one is available for your order still we will try and alot you someone . And then second call saying sorry can I set your appointment to 6:30 then also I said ok no issue will manage my work you  can change my appointment to 6:30 later again call come and the guy said sorry no one is available . If now one was ava then you would’ve not taken the booking it self . Don’t make people fool bh giving such service
5/11/2022,10:13:00 AM,1,Payment collected no service completed,"I booked sofa cleaning service on 9th May and payment was promotly dedicted from my paytm, post that I am been trying to track the service and website is always showing me error and their call centre number listed is wrong. There is no way to reach them once payment is collected.
Very poor exprience. I hope they call me back to sort out the issue, as I have written an email as well."
5/11/2022,11:58:00 PM,1,Scammers,Well never ever get services from urban clap. They are the biggest scammers and finding new ways to fetch money out of your pocket. Well I booked for AC service from this company for my 2 air conditioner and as per company policy they provide you a 3 months warranty on that. So that if in any case there is any problem you can call them within 3 months and you can get it fix under warranty. Now on April 16th I got both my air conditioner serviced and after few days one of my air conditioner started giving problem so I called them and they booked a revisit. Now again I started having problem with the air conditioner and I asked for revisit. To my surprise they told me that I cannot book a revisit because I have already claimed a re visit on that. So if this is the case then why you provide warranty for 3 months then. When I told them this thing they asked me to re book a new service and they will refund me the amount of 1900. Now here is the scam they doing. I paid 3700 in total for the services. Out of which they refunding me only 1900. Then they ask me to book a new service and then they charge 499 plus taxes plus the repair cost. So in that ways the 3 months warranty is just a show-off and they have new ways to fool people and fetch money. Please beware of this company. They are scammers. It's better to get AMC from the manufacturer directly. Never fall for this trap with urban clap
5/8/2022,9:03:00 AM,1,Pathetic service by Urban company!,"I booked slots for salon, booking confirmed, professional was also assigned, at the end moment they rescheduled the time to evening slot , when I tried contacting them, they said professional is not available, then y was it confirmed....This is really CRAP!"
4/26/2022,,1,"Charged ""Conveyance"" when technician was unable to initiate the AC cleaning work","I had booked for AC cleaning (Foam cleaning package for ?549) The technician arrived but was unable to remove the front covering of the indoor unit. With out removing the unit the cleaning could not be started. After trying for some time I managed to open one side of the AC front cover, how ever the other side was still not coming out, as per the technician the wall placement was incorrect and so the cover was not coming out. They decided to aondon the job. How ever in the app i was charged with ""partial work done"" and refund of ?200 was initiated.

NOTE - earlier the AC was fully cleaned by other experienced Urban Clap employee, by successfully removing cover.

I had raised a issue in the app, and every time I got a call back from the team, (once they had spoken) to them, my voice became inaudible and they disconnected. Their final verdict was nothing can be done.

While booking I was assured through the app:
1. Incase of service dissatisfaction, urban clap would send back their technician without any questions asked.

I WAS NOT INFORMED OF ANY ""CONVEYANCE"" FEE CHARGES

Resolution request from my end:
1. Pls resend person to complete the task of AC cleaning or,
2. Refund me the full amount ?549

Yet to hear back from them."
4/20/2022,5:38:00 PM,1,Pathetic and Non cooperative,"Booked urban company for refrigerator repair on three different days since they did not have professionals to handle the task of a refrigerator repair. Came back early from work on one day, Sunday on the other which was as per their advice n finally booked a third time n sat at home. The first time the dust exec apologised, the second time Sonia the exec disconnected the call even as I was speaking n third exec  Bhavna was classic. When I asked her why was I being prompted for a date n when it clearly showed refrigerator door repair was one of their services, she actually stated that the company website is undergoing a change. The date n professional not being available is a very poor state of management. Their email reply is pretty much like their earlier response. Kaise kar letey ho bhai! ??  God bless you guys. Anil, Gurgaon dated 20 April 22."
4/18/2022,8:48:00 PM,3,UNPROFESSIONAL COMPANY,"Two weeks ago, I hired their services for Bathroom deep Cleaning. When Technician Came, I switched on Light and Exahust fan. Both were working. When the technician finished job and called me, I switched on fan - there was a blast and fan stopped working. First of all, Job done was of very poor quality. Urban company has a clause in their application for paying compensation for damages to property. Even after following up matter with them for 2 weeks, i was told that it can not be given, as it is not technicians mistake.......
I have deleted their app from my mobile...I ADVICE ALL, DO NOT CALL THEM - THEY WILL BREAK YOUR EXPENSIVE ITEMS AND WILL NOT PAY COMPENSTATION"
4/17/2022,2:22:00 PM,1,Dont make any booking on sunday amd dont expect fo,"I had a booking for Ac repair. The professional canceled the booking without calling me while mentioning call not answered by customer.while raising the issue with cc person he suggested to cancel the visit explaining sir today is Sunday so we wouldn't be able to serve better to cancel and  planned for any other day.
So one thing is clear they are not able to serve on Sunday specifically in metro cities."
4/13/2022,5:41:00 PM,1,Scam....fraud... urban company is not good enough,"I booked the services today at 11.45 pm. The slot chosen was 5pm.
I was waiting for them to assign a professional. However at 5.10 pm I receive a call from URBAN COMPANY cx executive ""Tanya"" saying she does not have any professional. Her tone was very rude and she was taking things for granted.
Upon asking her to let me speak to a higher authority she did not let me speak. She was very rude and it felt like they were taking this whole thing for granted.
I had to suffer as i had an event tonight. Was not able to go.
Everytime I asked her  a question she only had one answer ""THIS IS AGAINST COMPANY POLICY""
I asked her to let me speak to her manager. She outright denied saying ""THIS IS AGAINST COMPANY POLICY"".
What kind of customer service is that??
I will post a review regarding this so no one gets scammed and waste their time."
4/12/2022,4:04:00 PM,3,Split AC servicing,"The personals attend for cleaning and servicing don't bring any cloth/cleaner, we have provided Colin/cloth/ liquid soap, and an ordinary cleaning, charging high, waste of money, they are well behaved but not Proffessional"
4/4/2022,9:33:00 PM,1,Booking without any professional,I have made a booking for an AC service and got it scheduled after 6days....6thday of waiting we got a message that the booking has been cancelled. Person Name Bahadur called and was talking a long time he says there are no professionals at all the booking are just taken and cancelled. I waited 6 hot summer days and resulted nothing....guys the service was not the way it was I am not going to  recommend urban company at all....this happened twice and most of my friends tell the same thing has happened to them too...it was so disappointing talking to the person names bahadur telling customer support with no authentication that he is from urban company...I have also taken 1year visit free package that's just a waste better avoid this urban company..
3/27/2022,3:31:00 PM,3,Urban company- Your time saver,"For me, it is one of best home service company.
Best of all services is its Home cleaning services including full home, kitchen , balcony floor, bathroom deep cleaning, Chimney deep cleaning, sofa cleaning and many more listed on their app."
3/22/2022,4:18:00 AM,1,Non Trustworthy Company (spoiling Mr. Tata's name),"Don't trust this Company for quality or their commitments.
My wife got our AC serviced from them in Jan end.  It was cold season so we never used AC. I was also traveling during that period to a great extent.  Hence no one checked it.
5 days back,  when I switched it on,  it was giving hot air.  We didn't realise the problem.  Next day again same happened and then my wife said that These guys had done some servicing and now our AC has got damaged.
Immediately  I wrote to UC about the problem and requested for help.  After 3 days,  they called me yesterday I got a call from UC to understand the issue.
After my discussions  the executive confirmed that a technician would come and get it sorted despite my 30 days warranty period getting over and that I don't have to pay anything. He called me 4 times to fix up an appointment.  Then suddenly he calls me and says that his Manager doesn't permit this visit since its not their fault. If I want, I need to book again and pay them.
Now I am sitting with a damaged AC unnecessarily.
So please don't trust their quality of work or their commitments."
3/17/2022,,1,"Worst service provider company in service sector,","They just give time and charge in advance for the service they are not going to provide.
Very worst experience in in air condition service.
Just gave time, time and time for a week but no one came for the service, actually we can't trust and blindly rely on this company."
3/3/2022,3:13:00 AM,1,Theft of valuables during deep cleaning service,Theft of valuables happened when I booked their deep cleaning services. Urban company simply said they are 3rd party contractors and can not help. Be careful and think twice before booking UC.
3/3/2022,11:37:00 PM,1,Urban company or scam company,"I had booked deep clean ac service for 8 acs in home at kanpur. The technician refused to deep clean, just washed ac with a bucket water and told me that he has to leave and will come the next day, but he did not and to my surprise closed the job by writing job done.
I complained in the app...and that guy came after 4 days. He once again did one ac...same style water bucket..no foam used as shown in the adds and on app...he said we do only like this and rushed from my home. I complained again and they apologised and sent some senior technician to service the ac. But without ending to the misery, the mechanic was stopped from working at my home by his seniors as he would charge the company for servicing the ac for which the company has taken huge sum of money....he waited for hours...one called to do it...other called to stop...eventually he went back without doing anything. I complained and they could not answer...the job is still open...money was paid...i feel cheated and humiliated...it's a fraud company with all company employee carrying out a nexus of looting people.soon going to file a f.i.r against the company and employees.
I request all to refrain from taking their service else you will feel cheated the same way they did with me. I am sharing my page of job which still shows work open and my complaint open."
1/19/2022,3:06:00 PM,1,Cheating,"Very bad experience after repairing Washing machine.
I've spent almost Rs.3000/- for repair and within couple of days stopped working.
Also in my booking history its showing as service cancelled by customer. Hence I'm unable to re-open the ticket.
From 24th Dec 2021 till date no solution"
12/25/2021,11:48:00 AM,1,Bunch of idiots,"Booked a service and their so called professional arrived and denied the service for asking him to follow the COVID guidelines specified by their idiot company called UrbanCompany. When asked for reassigning another professional, they say process of refunding is initiated and amount will be credited in 5-7 working days. Abey ch_ . if the service is not given, learn to ask the customer whether he wants it to be rescheduled or cancelled. Bosi_ apneaap decide karloge kya? Ch. jhund leke nikle service dene."
12/7/2021,5:20:00 PM,1,Horrible  service,The company used to be good but once you become regular they start cheating. They try to sell services which one has bot registered and then in my absence they say they have rendered services and charge more.
12/6/2021,4:02:00 PM,1,Very very bad,"Very very bad
Very very bad. Professionals are unprofessional. They cancel on u the last minute. Roadside parlour walis are coming to do your service even after paying a steep amount. They promise service redo but when u try to rebook they say that u had to take within 30days. Wat a scam"
11/2/2021,12:17:00 PM,1,Pathetic and unprofessional company,"Urban Company is a an unprofessional setup with the employees and CEO @abhiraj clueless on how the solve a problem.
I had booked a time slot for cleaning my sofa and got a confirmation from them. There was no call or intimation from them and after a few hours post the allocated time, I requested a call back from the contact center.
The people were clueless and incapable to solve the problem.
Please do not use Urban Company as its a unprofessional company and just a typical middle man and not adding any value at all."
10/10/2021,,1,Cheaters-Urban Clap,"Unprofessional behaviour with rude painters, which was extremely delayed and had to be ultimately shelved resulting in huge losses. It is advisable to stop bullying by these app companion"
9/17/2021,,1,Pathetic technical structure,"It seems that their technical structure is created by the new comers, their app stops working many times and it only allows to play a game over the app and its been multiple times and the worst part is they don't have any other channel for the communication as they never read the mails and never respond to the mail except the auto-mailer. In addition, there is no point to escalate the issues to their leadership as they also don't support the customer. Recently, there was another issue found due to their poor policy and pathetic technical structure when my amount did not credited to my original source. God knows how this organisation is running."
8/31/2021,6:05:00 PM,1,Terrible experience with this company,"I did Loreal team removal facial and I got big rashes on my face on next day itself. I asked to call me back. I got call from customer support and have shared my forehead pic as a proof. They are ready to give dermatologist amount. But I am not ready with that, because firstly my face got damaged secondly that facial is null without any result. So asked them to refund my facial amount. But they are not ready to refund my amount"
8/29/2021,,1,Why not double dose vaccination done to your staff,Employee of Urban Clap were not being vaccinated with the 2 nd dose. Why??? When 1st dose was given on June...so 2 nd dose should be completed by September. Why so dely??? Will not call you again.
8/13/2021,8:17:00 PM,1,DO NOT USE Urban Company for Painting Services,"Surveyor overestimated wall area so that Urban Company(UC) can charge more money.
Painting Supervisor was nowhere to be seen when painting was in progress.
Was promised 1 coat of Wall Primer, All cracks filled, 2 coats of Apcolite Premium emulsion for all interior walls. 2 coats of Apex Ultima for exterior walls
WHAT I GOT: incomplete work as painters were not given sufficient paint to paint. At the end of the work, all the walls had patches and look very ugly. Only 1 coat of some low quality paint was applied on the walls.
When I raised a complaint with Urban Company, I received abusive calls.
I have a call recordings and whatsapp communciation to prove all of the above.
MY ADVICE TO THE READERS: Go with your local painter instead of Urban Company; they are more sincere and will do a much better job. You will also not get any abusive phone calls."
