Date,Time,Ratings,Review_Title,Review_comment
2/25/2024,1:15:00 PM,1,Urban company- the worst ever company,"Worst company ever, highly unprofessional technicians. Their only objective is to fleece money out of the customers."
2/14/2024,10:45:00 AM,1,Feeling LOOTED!!!!!,Feeling LOOTED!!!!!....For Chimney Cleaning ...I was charged 600 Rupees ... same simple work could have been done by any house maid by Rs 50-100 tip ?? Guys BEWARE the Kind of work to be done and it Charges......don't get Fooled
2/7/2024,3:12:00 AM,1,Worst service,"Wastage of money and time, there professionals are unskilled unprofessional and no sense of time … i have tried there services 5 6 time in 3 year there services are getting bad and bad…they will never come at time, either they will come 1 hou early or one hour late .. no point of booking an appointment"
1/6/2024,2:12:00 PM,1,Urban company full body massage head to toe,"I recently booked a full-body massage from Urban Company, hoping for a relaxing experience. However, my encounter with Dhanjay Kumar Singh was far from satisfactory. To start, he arrived late at 11:30 AM, which was quite inconvenient. During the massage, the pressure applied was disappointingly weak, hardly providing the relief I had anticipated. It felt more like a gentle touch rather than a massage aimed at relieving tension and stress.

To compound my disappointment, the session ended abruptly after just 90 minutes, well short of the promised duration for a full-body massage. When I voiced my concerns about the lack of pressure, Mr. Singh suggested I should have chosen a ""pain relief"" package, an unprofessional and insensitive response to my valid concerns. My expectation was a rejuvenating experience, but instead, I left feeling unsatisfied and frustrated.

Maintaining the quality and professionalism of services is crucial for Urban Company's reputation, and I urge them to reconsider offering services with Dhanjay Kumar Singh."
12/21/2023,1:52:00 PM,1,Unprofessional behaviour,"Urban company showcases that it’s organised. For everything which they mess up all they have is to say sorry. Instead of solving they ask you to do a few more things .

I booked an appointment for getting chimney repair . 20mins before the scheduled time the technician calls and say I am in the hospital since yesterday. Instead of assigning a new technician they are asking me to reschedule the appointment because customer time is free.

Now I have to cancel it and redo the entire thing.

Then they don’t have a number you have to talk to a chat bot .

Never get their services if you got it then thank god on that day. Else be ready to go round and round . They will give you good stories as they are good at it."
11/27/2023,10:45:00 AM,1,Urban Company Warranty Fraud,"I  booked a cracking sound from TV complaint on urban company on 2nd October 2023. They quoted some 3500/- for repair.

I accepted quote, they took my TV, repaired it and returned on a payment of Rs.3420/-.

But problem recurred in a month or so. Since they had given warranty that they will repair for free if the same problem occurred again in six months, I booked a revisit on 15 Nov again.

They again took my TV, repaired it and returned. But this time, the cracking sound returned within a week with additional problem of screen going blank.

I again tried to book a revisit. They registered but then closed complaint after a few days without any revisit. And they have designed their app in such a manner, that there is no way that I could book a revisit or claim warranty.

To carry out their intentional fraud of not honouring their warranty, they froze their app to a single point where I could not proceed on app without paying a paltry Rs.30/-. It was a small amount, so I paid.

But it was a trap I feel, now they refunded this Rs.30/- immediately to my account and claim that the warranty is settled as they have refunded the Rs.30/- payment.

All options of reopening the job are not functional on the app now.

I’m thinking of lodging a case in consumer court now for this blatant fraud. If any learned lawyer can take this case to conclusion, he may DM me here in comments.

I have taken necessary screen shots just in case Urban Company decides to block my account after this complaint."
11/24/2023,2:06:00 PM,1,Installation of M1 water purifier,"Recently I purchased a Native M1 water purifier from Amazon. A technician of Urban Company came to my place for installation two days later. After visiting my place he immediately commented that the space in the kitchen is not suitable for installation. When I asked him why, he said that the space for installation will be too high or too low. He insisted to return the machine and purchase water purifier of some other company. I reported the issue to the company.

Seven days later another technician was sent to my place again. He also refused to install it giving same reason first. I requested him to install it in the kitchen at slightly raised height and I said that collection of water from that level will not be a big problem. He then said that the concealed water pipeline and electrical line may get damaged and many other silly excuses. I then suggested him to install it in the balcony wher both electrical and water connections are available. He again refused to install it and also continuously insisted me to return the machine and purchase water purifier of other company. He also left my place without even unboxing the package.

Highly disappointed with the attitude of technicians for refusing to install it without showing acceptable reasons.

I had a feeling of some foul play behind it; these technicians might work for other companies.

Urban Company should be cautious about these kind of technicians who are damaging the reputation of the company."
11/17/2023,,1,Worst service,"WORST - I have purchased M2 Water Purifier. To install the Machine no proper technician available. Simply attended as an officer of customer and said that It can be installed and the Machine is not suitable to install. He wants to install on open space and near by sink or Morie so that in case of machine leaks it will go to sink. He is not able answer why the leakage will get. Finally, we collect back the machine and refund will be initiated. WORST. i READ THE LEAKAGE ISSUE OF MACHINE ON THE ASSURENCE OF SALES PEOPLE PURCHASED."
11/16/2023,12:15:00 PM,1,Pathetic company,"I booked for a mens haircut for my father. I immediately received a booking confirmation for 11am. However, I did not receive any intimation from them till 11:40am. After I called on the number, the assigned person had the audacity to say I was sleeping so I will come at 12:30pm.

At 12noon I got a message from Urban Company saying your appointment has been cancelled and that they have rescheduled it for 2pm. This was assuming your customers are waiting for your fraud and pathetic response. I have no option but to cancel their service and henceforth will never assign Urban Company for anything."
11/16/2023,10:33:00 AM,2,Unprofessional ``professionals'',"We needed a 3BHK flat cleaned urgently before a deadline for a new tenant to move in. We booked UC for the job. On the appointed

day, the professional cleaner showed up and told us incorrectly that this was `not 3BHK' and refused to do the job unless we cancelled the booking, as an incorrect booking, paying a cancellation fee. We were also to pay him directly(not the Urban Company) `under the table' for doing the job. We complained to Urban Company, who

understood the situation and refunded our cancellation fee. The cleaning `professional' called us and abused us over the phone for informing UC. We went through a lot of stress as a result. We feel UC should not be hiring such people. Luckily we found a professional

alternative in Clean Fanatics, who came and did the job perfectly."
11/15/2023,8:15:00 PM,1,Chimney cleaning very un professional,"The chimney started dripping oil in 10 days, when called support they say I should have reported this within 72 hours

I paid Rs. 700/ - for this ."
11/15/2023,11:35:00 AM,1,Always cancelling the booking on the spot,"The worst company, they keep cancelling the bookings on the time of cleaner need to arrive, or they reschedule fir another day with out informing the customer. You find out just when you text them to check why the professional is late.

For Urban company this is normal. No compensation, no apology. They are so unprofessional on scheduling."
11/11/2023,4:56:00 PM,1,HARASSMENT,UC professionals have HARASSED me on diwali. Upon escalation I received zero support. Extremely horrible experience be safe beware they harass customers and dont take ownership of their behaviour
11/8/2023,7:55:00 PM,1,Disaaointment home ckeaning service and moonligjti,"Booked home cleaning service for my 1 bhk flat for 8;00 am. Cleaning team of 2 people show- up at 8.30 am with no intimation of being late. As per the pricess manager enters OTP the moment the work begins, no show from manager. Only 2 team members show up, 2nd one is called, up by the team leader at 9.30 am and he is away from the job site for 1.5 hours. Only 1 member does the cleaning. 2 members (includes team leader) show up at 11:00 am. Seems 2 of them were finishing floor cleaning and vacuuming for another customer. At 1 pm team of 3 wind up work, with window glass of my toilet broken and half finished work, Shabby work delivery. Extremely dissatisfied with thei services during Diwali. Urban company I have lost trust in your brand and your work ethics. Stop moonlighting if you can't handle high customer demand during festive time."
11/3/2023,5:34:00 PM,1,My painting work experience with UC,"Recently I got my house painting done by Urban Company. Their advertisements are misleading -'ek bhi galti ho toh pura painting free'. They are very costly and the service quality is very very poor. They said there is 1 yr warranty. I called the person who did the painting work for me to rectify the work done by him. He stopped answering my calls. Then I made a complaint to UC, but no action taken so far. Think twice before you engage UC for any work. They are not professionals"
11/3/2023,3:53:00 PM,1,Urban company M1 ro order not delivered no refund,My name Aditya Mishra. I ordered urban company M1 ro 21 oct. It's not delivered after 10 days & status is showing sheeping
11/2/2023,5:02:00 PM,1,Cleaning services by Urban,Very unprofessional behaviour by the company employees.Not trust worthy and they are cheating the customers.They are blocking the slots in online and on calling to their Customer care no they said slots are not available but I am calling back with another number and I will book the slots for you.They are calling with their personal numbers and saying sir though slots are not available but I will give you slot for that you have to pay the extra charges as premium services and they are asking money for 6400 instead of 3400 for the same job which shows on their app.Totally wasting time and money .They are only for making money.Though company may not be saying to do so but they must check on their employees. They have wasted my time. Though this was my first time trying to book but first impression goes worst.
10/29/2023,5:30:00 PM,1,"Worst service, hidden charges and unreliable","My TV repair done through urban company didn't even last for a month. Also at the time of repair initially the repairmen didn't convey that it would cost us 5k Rs. and later I was compelled to pay the amount. I would have instead repaired my TV locally, atleast it would have been durable."
10/24/2023,4:36:00 PM,1,Tricking customers,"I used UC to evaluate for a painting service. They came home with an instrument to measure the room size. I can say that they are fooling the customer by doing misinterpretation of measurement by using this instrument which is not correctly showing the value. I have observed that this instrument is not calibrated , hence the value it shows cannot be trusted."
10/20/2023,10:24:00 PM,5,Service based,"I am so glad to review this urban company. I used many services like water purifier , a/c general service, fridge repair and washing machine repair , plumbing , electrical services"
10/17/2023,12:18:00 PM,1,Worst company ever,"Five months ago, I called Urban Company to repair an AC. The technician first said the gas must have run out -- I had got it filled just a month earlier from them so it was supposedly under warranty. When I told him that, he said the warranty for places near water bodies was 15 days! (My flat is not that close to any water body -- by this logic, every place is Bombay is.)Anyway, he checked the AC and said the gas was ok. After two days of trying to figure out what was wrong, he said two parts needed to be replaced. He quoted an exorbitant amount for second-hand components which, the AC company told me was more than what new parts cost. Anyway, since I had to get it done, I paid up. Today, five months later, the AC is not working again.

This company has incompentent technicians, overcharges and does not give warranties. The worst part is that it does not have a dedicated number, and there is no way to complain directly. If you look at the Urban Company reviews anywhere, there are hundreds of complaints against it but it remains untouched. If we had anything like a class action lawsuit in India (where many people get together and file a case), this company would be taken to the cleaners. It deserves to be shut down."
10/17/2023,9:13:00 AM,1,Company is unprofessional.,"I booked for electrician on 21.09.2023, the company failed to assign tech for the job in allotted time slot and I cancelled the service, I have not received refund till date, it's customer care number is not available to lodge complaint and on my mobile the reply says no refund will be issued, that is surprising, I think the company is not trustworthy and is not proffessinoal.

The behaviour of company is cheating customer"
10/14/2023,,1,"
1.0 out of 5 stars Expensive service poor customer care","Very expensive service, electrician worked for one hr and charges were INR 800. Very poor customer service, no phone number for customer care. Very poor response from customer care, almost impossible to get through."
10/11/2023,5:18:00 PM,1,Scary cleaners threatened my elderly parents,"I have been using UC for years now for home cleaning, haircuts, painting, carpentry, etc. Two days ago Masud (cleaner) was assigned to clean my home on a Classic package. He waited for my brother to leave for work and then started pestering my 70+ year old dad for more money and to upgrade the package to premium. My dad doesn't know about the packages since I book everything for them on the app. My dad agreed to pay 4k more than what I booked. He then started threatening my parents that he wanted the money before the job is done. He went into my mother's bedroom and started shouting. I called the UC trust center as soon as my mom called me in panic (I don't live in the same state as my parents). I told Masud to leave my house at once or I'd call the police. He kept threatening then after UC also told him, he finally left. He made my parent's home so dirty and threw water everywhere. My parents were so scared. UC kept asking for time since I wanted to file a FIR. Two days later they are calling to close the ticket and gave RS150 coupons. Such unprofessional idiots. Please be careful with elderly and safety of your lived ones. I don't think they are vetting their staff properly. Very horrible and scary experience."
10/11/2023,,1,Scary cleaners threatened my elderly parents,"I have been using UC for years now for home cleaning, haircuts, painting, carpentry, etc. Two days ago Masud (cleaner) was assigned to clean my home on a Classic package. He waited for my brother to leave for work and then started pestering my 70+ year old dad for more money and to upgrade the package to premium. My dad doesn’t know about the packages since I book everything for them on the app. My dad agreed to pay 4k more than what I booked. He then started threatening my parents that he wanted the money before the job is done. He went into my mother’s bedroom and started shouting. I called the UC trust center as soon as my mom called me in panic (I don’t live in the same state as my parents). I told Masud to leave my house at once or I’d call the police. He kept threatening then after UC also told him, he finally left. He made my parent’s home so dirty and threw water everywhere. My parents were so scared. UC kept asking for time since I wanted to file a FIR. Two days later they are calling to close the ticket and gave RS150 coupons. Such unprofessional idiots. Please be careful with elderly and safety of your lived ones. I don’t think they are vetting their staff properly. Very horrible and scary experience."
9/26/2023,11:36:00 AM,1,"Poor, unprofessional, horrible, shameless service","I wanted to get my washing machine repaired as it was tripping continuously. The technician came and gave me an estimate of 6500rs. I denied the extra that they were charging to change the motor. So I requested a call from UC to understand. The technician agent Ritwik initially said that the motor can be changed later and the seal bearing can be changed for now. However, I will not get an guarantee for the entire machine. I agreed to that. The technician started working, he opened the machine and was checking. Suddenly he received a call to stop the work and leave my place. I never received any call from UC regarding stopping of work. I called UC and they said they will not do the work if I don't change the motor. This clearly shows that UC didn't do my work since I was not ready to pay for the motor which was actually not needed to be changed but was added to squeeze extra money. The technician over the phone was rude and behaved unprofessionally.

The technician stopped the work without even informing me."
9/24/2023,4:09:00 PM,1,Not Satisfied With Their Cleaning Service,"I booked their services to have my bathroom thoroughly cleaned, but the results were nothing short of abysmal. It's astonishing how a company that claims to provide professional cleaning services could fall so short of expectations.

Firstly, the cleaner arrived late, which was an inconvenience from the start. When they finally got to work, it became apparent that they had no idea what a ""thorough"" cleaning meant. The bathroom was left in a worse state than it was before their arrival. There were still visible stains on the tiles, soap scum on the shower glass, and grime in the corners that had been entirely neglected.

To make matters worse, they used harsh chemicals that left an overpowering, unpleasant odor that lingered for hours. I expected a fresh, clean scent, but instead, my bathroom smelled like a chemical factory.

Customer service was equally disappointing. When I contacted UrbanCompany.com to express my dissatisfaction, they were unresponsive and unapologetic. It's clear they prioritize profit over customer satisfaction.

I wouldn't recommend UrbanCompany.com to anyone seeking quality cleaning services. Their incompetence, poor customer service, and lack of professionalism are truly frustrating and make it a waste of time and money. Avoid at all costs."
9/20/2023,3:40:00 PM,1,Urban company non professional services,"In last 2 years I booked 3 to 4 services from urban company. In all the cases, their non professionals have rescheduled my booking slot by themselves without my permission. In my last booking for kitchen cleaning, their non professional spoke to me and I insisted not to reschedule at all. He said ok, disconnected the call and rescheduled. In one other case, that time I was a member and they rescheduled it after 2 days. Their non professional came, did the service and within 10 days the problem appeared. One other surprising thing is their non professionals carry central government’s skill development certificate which is to cheat people. Finally I cancelled my service and booked it thru nobroker. Nobroker’s professionals came on time in fact 3mins before scheduled time. So I decided not to use urban company app anymore and simply use nobroker as alternative."
9/17/2023,12:44:00 PM,1,Poor service by Urban Company,I booked a professional from urban company for ac repair and they have made the condition worst than before. All lies and no truth about it. I have ask3d for compenstation of the product damaged by their professional.
9/16/2023,10:39:00 PM,1,Frauds,Booked Premium deep cleaning service for my house. cleaners came. turned the house Topsy turvy. I asked them to clean a corner. cleaner got angry and aggressive saying I was interfering. he pulled his appliance plug out and left leaving the house in bigger mess. I requested him to finish the workor at least fix back the house. he said I should deal with urban company. I tried to complain to Urban company. they did nothing to amend the situation.
9/16/2023,10:41:00 AM,1,Commitment Issue,We booked slot seven days before and we are planning accordingly but few hours before they cancelled. It's very unfortunate. This is clearly commitment issue.
9/10/2023,9:47:00 PM,1,Service Not Satisfactory,"I recently booked a pedicure service with Urban Company, and unfortunately, I must say that I was quite disappointed with the experience. The service was far from satisfactory, and here's why:

Rushed and Inattentive: The professional who arrived at my place seemed disinterested from the beginning. It felt like he was just going through the motions to complete the service as quickly as possible. There was a clear lack of attention to detail.

Faulty Equipment: To add to my disappointment, the equipment he brought along appeared to be faulty. The foot spa wasn't working correctly, and it took several attempts to get it started. This wasted valuable time and left me feeling frustrated.

Incomplete Work: One of the most essential aspects of a pedicure is the removal of dead skin and calluses. Unfortunately, this crucial step was overlooked. I could still feel rough patches on my feet, which was disappointing.

Minimal Massage: The brief foot massage I received was for a mere minute, if not less. A good pedicure should include a relaxing and rejuvenating massage, which was notably absent in this case.

Overall, my experience with Urban Company's pedicure service was subpar, and I did not receive the quality of service I expected. I hope this feedback helps them improve their services and ensure that customers receive the excellent and relaxing experience they deserve."
9/9/2023,10:12:00 PM,1,My worst experience towards this company,"This is the worst company I have ever visited to. I don't like the overall company worst experience.
"
9/9/2023,10:03:00 PM,1,Fraud organisation on the name of providing servic,"Worst experience with the unprofessional service partners and customer support when approached. They doesn't know how to communicate with a loyal customer and resolve an issue with some dignity. Simply copy and paste apology message and 50rs Urban Credit as if we are begging them. Most of the service partners visit home, ask us to cancel the booking, then do the service and charge us personally that too with a scan code, since we can raise a complaint when amount is paid to their contact number. Be aware of these fraud service partners"
9/1/2023,7:50:00 PM,1,Worst quality painting service,"Worst customer service and worst painting quality issues. Customer care executive give flase promises and say aorry we can't do anything right now. I love to support you air but we are helpless.

Sajid is executive done the painting service - he is not having any experience and absconding after stated raising painting quality issues. Never respond to customer complaints. Never book any service from urban company."
8/31/2023,12:11:00 PM,1,Classic full House cleaning,"I hope u ready my review before u ask urban company to come and clean ur house. Urban company services are a ripoff. No value for money. We asked for a full home cleaning. The job was average for the price charged to just do a dusting job that to with only a dry cloth for 3000/- and they tell u that what u ordered for u want us to use a wet cloth pay nother 1000. And u need to be vigilant on the cleaning as they will do a superficial job. We had to point out that u have missed some spot here or there, in-fact after the clean I felt my house was more dusty than before. The company should we sued for fake advertising they don’t have any tech for deep cleaning etc. though I dint give a bad rating for the guys on the app. As I just wanted to get done with them. But I will never call urban company again for any services and have deleted the app as well."
8/18/2023,7:32:00 PM,1,Very bad service,Dont go for this company anymore waste of money people dint worked proper for premium plan and asking for extra money before starting work itself
